2025-05-28 10:45:59.470912 vethb391c0f Out IP6 linux-amd64-gpu-rtxa6000-latest-2-nemo-6qvzc-runner-dpk6b > ff02::16: HBH ICMP6, multicast listener report v2, 1 group record(s), length 28
2025-05-28 10:45:59.471007 docker0 Out IP6 linux-amd64-gpu-rtxa6000-latest-2-nemo-6qvzc-runner-dpk6b > ff02::16: HBH ICMP6, multicast listener report v2, 2 group record(s), length 48
2025-05-28 10:45:59.471033 vethb391c0f Out IP6 linux-amd64-gpu-rtxa6000-latest-2-nemo-6qvzc-runner-dpk6b > ff02::16: HBH ICMP6, multicast listener report v2, 2 group record(s), length 48
2025-05-28 10:45:59.551817 enp3s0 Out IP linux-amd64-gpu-rtxa6000-latest-2-nemo-6qvzc-runner-dpk6b.48620 > ingress-local-ingress-nginx-controller.ingress-nginx.svc.cluster.local.https: tcp 1046
2025-05-28 10:45:59.551903 enp3s0 Out IP linux-amd64-gpu-rtxa6000-latest-2-nemo-6qvzc-runner-dpk6b.48620 > ingress-local-ingress-nginx-controller.ingress-nginx.svc.cluster.local.https: tcp 8928
2025-05-28 10:45:59.586336 enp3s0 In  IP ingress-local-ingress-nginx-controller.ingress-nginx.svc.cluster.local.https > linux-amd64-gpu-rtxa6000-latest-2-nemo-6qvzc-runner-dpk6b.48620: tcp 35
2025-05-28 10:45:59.586444 enp3s0 Out IP linux-amd64-gpu-rtxa6000-latest-2-nemo-6qvzc-runner-dpk6b.48620 > ingress-local-ingress-nginx-controller.ingress-nginx.svc.cluster.local.https: tcp 4355
2025-05-28 10:45:59.606528 enp3s0 Out IP linux-amd64-gpu-rtxa6000-latest-2-nemo-6qvzc-runner-dpk6b.39034 > lb-140-82-112-21-iad.github.com.https: tcp 2848
2025-05-28 10:45:59.606984 enp3s0 Out IP linux-amd64-gpu-rtxa6000-latest-2-nemo-6qvzc-runner-dpk6b.36926 > 20.102.38.122.https: tcp 2856
2025-05-28 10:45:59.606997 enp3s0 Out IP linux-amd64-gpu-rtxa6000-latest-2-nemo-6qvzc-runner-dpk6b.36926 > 20.102.38.122.https: tcp 219
2025-05-28 10:45:59.621776 enp3s0 In  IP ingress-local-ingress-nginx-controller.ingress-nginx.svc.cluster.local.https > linux-amd64-gpu-rtxa6000-latest-2-nemo-6qvzc-runner-dpk6b.48620: tcp 130
2025-05-28 10:45:59.621787 enp3s0 In  IP ingress-local-ingress-nginx-controller.ingress-nginx.svc.cluster.local.https > linux-amd64-gpu-rtxa6000-latest-2-nemo-6qvzc-runner-dpk6b.48620: tcp 43
2025-05-28 10:45:59.622341 enp3s0 Out IP linux-amd64-gpu-rtxa6000-latest-2-nemo-6qvzc-runner-dpk6b.48620 > ingress-local-ingress-nginx-controller.ingress-nginx.svc.cluster.local.https: tcp 0
2025-05-28 10:45:59.635884 enp3s0 Out IP linux-amd64-gpu-rtxa6000-latest-2-nemo-6qvzc-runner-dpk6b.39028 > lb-140-82-112-21-iad.github.com.https: tcp 278
2025-05-28 10:45:59.644541 enp3s0 In  IP lb-140-82-112-21-iad.github.com.https > linux-amd64-gpu-rtxa6000-latest-2-nemo-6qvzc-runner-dpk6b.39034: tcp 0
2025-05-28 10:45:59.646363 enp3s0 In  IP 20.102.38.122.https > linux-amd64-gpu-rtxa6000-latest-2-nemo-6qvzc-runner-dpk6b.36926: tcp 0
2025-05-28 10:45:59.651294 enp3s0 In  IP lb-140-82-112-21-iad.github.com.https > linux-amd64-gpu-rtxa6000-latest-2-nemo-6qvzc-runner-dpk6b.39034: tcp 855
2025-05-28 10:45:59.651358 enp3s0 Out IP linux-amd64-gpu-rtxa6000-latest-2-nemo-6qvzc-runner-dpk6b.39034 > lb-140-82-112-21-iad.github.com.https: tcp 0
2025-05-28 10:45:59.653936 enp3s0 In  IP 20.102.38.122.https > linux-amd64-gpu-rtxa6000-latest-2-nemo-6qvzc-runner-dpk6b.36926: tcp 726
2025-05-28 10:45:59.654000 enp3s0 Out IP linux-amd64-gpu-rtxa6000-latest-2-nemo-6qvzc-runner-dpk6b.36926 > 20.102.38.122.https: tcp 0
2025-05-28 10:45:59.659815 enp3s0 Out IP linux-amd64-gpu-rtxa6000-latest-2-nemo-6qvzc-runner-dpk6b.36926 > 20.102.38.122.https: tcp 2856
2025-05-28 10:45:59.659853 enp3s0 Out IP linux-amd64-gpu-rtxa6000-latest-2-nemo-6qvzc-runner-dpk6b.36926 > 20.102.38.122.https: tcp 1269
2025-05-28 10:45:59.661461 enp3s0 Out IP linux-amd64-gpu-rtxa6000-latest-2-nemo-6qvzc-runner-dpk6b.36926 > 20.102.38.122.https: tcp 534
2025-05-28 10:45:59.673989 enp3s0 In  IP lb-140-82-112-21-iad.github.com.https > linux-amd64-gpu-rtxa6000-latest-2-nemo-6qvzc-runner-dpk6b.39028: tcp 0
2025-05-28 10:45:59.698978 enp3s0 In  IP 20.102.38.122.https > linux-amd64-gpu-rtxa6000-latest-2-nemo-6qvzc-runner-dpk6b.36926: tcp 0
2025-05-28 10:45:59.700678 enp3s0 In  IP 20.102.38.122.https > linux-amd64-gpu-rtxa6000-latest-2-nemo-6qvzc-runner-dpk6b.36926: tcp 0
2025-05-28 10:45:59.714800 lo    In  IP localhost.38940 > localhost.domain: UDP, length 71
2025-05-28 10:45:59.714831 lo    In  IP localhost.38940 > localhost.domain: UDP, length 71
2025-05-28 10:45:59.715246 enp3s0 Out IP linux-amd64-gpu-rtxa6000-latest-2-nemo-6qvzc-runner-dpk6b.60698 > kube-dns.kube-system.svc.cluster.local.domain: UDP, length 71
2025-05-28 10:45:59.715540 enp3s0 Out IP linux-amd64-gpu-rtxa6000-latest-2-nemo-6qvzc-runner-dpk6b.40586 > kube-dns.kube-system.svc.cluster.local.domain: UDP, length 71
2025-05-28 10:45:59.731365 vethb391c0f B   ARP, Request who-has 172.17.0.2 tell 172.17.0.2, length 28
2025-05-28 10:45:59.731365 docker0 B   ARP, Request who-has 172.17.0.2 tell 172.17.0.2, length 28
2025-05-28 10:45:59.747936 enp3s0 In  IP 20.102.38.122.https > linux-amd64-gpu-rtxa6000-latest-2-nemo-6qvzc-runner-dpk6b.36926: tcp 741
2025-05-28 10:45:59.751984 enp3s0 Out IP linux-amd64-gpu-rtxa6000-latest-2-nemo-6qvzc-runner-dpk6b.36926 > 20.102.38.122.https: tcp 2856
2025-05-28 10:45:59.752004 enp3s0 Out IP linux-amd64-gpu-rtxa6000-latest-2-nemo-6qvzc-runner-dpk6b.36926 > 20.102.38.122.https: tcp 219
2025-05-28 10:45:59.758793 docker0 Out IP6 linux-amd64-gpu-rtxa6000-latest-2-nemo-6qvzc-runner-dpk6b > ff02::16: HBH ICMP6, multicast listener report v2, 2 group record(s), length 48
2025-05-28 10:45:59.758814 vethb391c0f Out IP6 linux-amd64-gpu-rtxa6000-latest-2-nemo-6qvzc-runner-dpk6b > ff02::16: HBH ICMP6, multicast listener report v2, 2 group record(s), length 48
2025-05-28 10:45:59.791220 enp3s0 In  IP 20.102.38.122.https > linux-amd64-gpu-rtxa6000-latest-2-nemo-6qvzc-runner-dpk6b.36926: tcp 0
2025-05-28 10:45:59.792945 enp3s0 In  IP kube-dns.kube-system.svc.cluster.local.domain > linux-amd64-gpu-rtxa6000-latest-2-nemo-6qvzc-runner-dpk6b.60698: UDP, length 419
2025-05-28 10:45:59.793748 lo    In  IP localhost.domain > localhost.38940: UDP, length 206
2025-05-28 10:45:59.797637 enp3s0 In  IP 20.102.38.122.https > linux-amd64-gpu-rtxa6000-latest-2-nemo-6qvzc-runner-dpk6b.36926: tcp 724
2025-05-28 10:45:59.801080 enp3s0 Out IP linux-amd64-gpu-rtxa6000-latest-2-nemo-6qvzc-runner-dpk6b.36926 > 20.102.38.122.https: tcp 2856
2025-05-28 10:45:59.801096 enp3s0 Out IP linux-amd64-gpu-rtxa6000-latest-2-nemo-6qvzc-runner-dpk6b.36926 > 20.102.38.122.https: tcp 434
2025-05-28 10:45:59.820757 enp3s0 In  IP kube-dns.kube-system.svc.cluster.local.domain > linux-amd64-gpu-rtxa6000-latest-2-nemo-6qvzc-runner-dpk6b.40586: UDP, length 357
2025-05-28 10:45:59.821539 enp3s0 Out IP linux-amd64-gpu-rtxa6000-latest-2-nemo-6qvzc-runner-dpk6b.49391 > kube-dns.kube-system.svc.cluster.local.domain: UDP, length 66
2025-05-28 10:45:59.840145 enp3s0 In  IP 20.102.38.122.https > linux-amd64-gpu-rtxa6000-latest-2-nemo-6qvzc-runner-dpk6b.36926: tcp 0
2025-05-28 10:45:59.881671 enp3s0 In  IP kube-dns.kube-system.svc.cluster.local.domain > linux-amd64-gpu-rtxa6000-latest-2-nemo-6qvzc-runner-dpk6b.49391: UDP, length 163
2025-05-28 10:45:59.882232 lo    In  IP localhost.domain > localhost.38940: UDP, length 219
2025-05-28 10:45:59.882697 enp3s0 In  IP 20.102.38.122.https > linux-amd64-gpu-rtxa6000-latest-2-nemo-6qvzc-runner-dpk6b.36926: tcp 0
2025-05-28 10:45:59.883160 enp3s0 Out IP linux-amd64-gpu-rtxa6000-latest-2-nemo-6qvzc-runner-dpk6b.46102 > 57.150.27.1.https: tcp 0
2025-05-28 10:45:59.888495 enp3s0 In  IP 20.102.38.122.https > linux-amd64-gpu-rtxa6000-latest-2-nemo-6qvzc-runner-dpk6b.36926: tcp 738
2025-05-28 10:45:59.918839 enp3s0 Out IP linux-amd64-gpu-rtxa6000-latest-2-nemo-6qvzc-runner-dpk6b.37062 > 52.224.205.173.https: tcp 0
2025-05-28 10:45:59.922535 enp3s0 In  IP 57.150.27.1.https > linux-amd64-gpu-rtxa6000-latest-2-nemo-6qvzc-runner-dpk6b.46102: tcp 0
2025-05-28 10:45:59.922655 enp3s0 Out IP linux-amd64-gpu-rtxa6000-latest-2-nemo-6qvzc-runner-dpk6b.46102 > 57.150.27.1.https: tcp 0
2025-05-28 10:45:59.926753 enp3s0 Out IP linux-amd64-gpu-rtxa6000-latest-2-nemo-6qvzc-runner-dpk6b.46102 > 57.150.27.1.https: tcp 353
2025-05-28 10:45:59.930823 enp3s0 Out IP linux-amd64-gpu-rtxa6000-latest-2-nemo-6qvzc-runner-dpk6b.36926 > 20.102.38.122.https: tcp 0
2025-05-28 10:45:59.966728 enp3s0 In  IP 57.150.27.1.https > linux-amd64-gpu-rtxa6000-latest-2-nemo-6qvzc-runner-dpk6b.46102: tcp 99
2025-05-28 10:45:59.966828 enp3s0 Out IP linux-amd64-gpu-rtxa6000-latest-2-nemo-6qvzc-runner-dpk6b.46102 > 57.150.27.1.https: tcp 0
2025-05-28 10:45:59.970314 enp3s0 Out IP linux-amd64-gpu-rtxa6000-latest-2-nemo-6qvzc-runner-dpk6b.46102 > 57.150.27.1.https: tcp 424
2025-05-28 10:46:00.012271 enp3s0 In  IP 57.150.27.1.https > linux-amd64-gpu-rtxa6000-latest-2-nemo-6qvzc-runner-dpk6b.46102: tcp 5792
2025-05-28 10:46:00.012511 enp3s0 In  IP 57.150.27.1.https > linux-amd64-gpu-rtxa6000-latest-2-nemo-6qvzc-runner-dpk6b.46102: tcp 1814
2025-05-28 10:46:00.013121 enp3s0 Out IP linux-amd64-gpu-rtxa6000-latest-2-nemo-6qvzc-runner-dpk6b.46102 > 57.150.27.1.https: tcp 0
2025-05-28 10:46:00.017144 enp3s0 Out IP linux-amd64-gpu-rtxa6000-latest-2-nemo-6qvzc-runner-dpk6b.46102 > 57.150.27.1.https: tcp 74
2025-05-28 10:46:00.021352 enp3s0 Out IP linux-amd64-gpu-rtxa6000-latest-2-nemo-6qvzc-runner-dpk6b.46102 > 57.150.27.1.https: tcp 2664
2025-05-28 10:46:00.056623 enp3s0 In  IP 57.150.27.1.https > linux-amd64-gpu-rtxa6000-latest-2-nemo-6qvzc-runner-dpk6b.46102: tcp 103
2025-05-28 10:46:00.060257 enp3s0 In  IP 57.150.27.1.https > linux-amd64-gpu-rtxa6000-latest-2-nemo-6qvzc-runner-dpk6b.46102: tcp 0
2025-05-28 10:46:00.060318 enp3s0 In  IP 57.150.27.1.https > linux-amd64-gpu-rtxa6000-latest-2-nemo-6qvzc-runner-dpk6b.46102: tcp 0
2025-05-28 10:46:00.068788 enp3s0 Out IP linux-amd64-gpu-rtxa6000-latest-2-nemo-6qvzc-runner-dpk6b.36926 > 20.102.38.122.https: tcp 2856
2025-05-28 10:46:00.068816 enp3s0 Out IP linux-amd64-gpu-rtxa6000-latest-2-nemo-6qvzc-runner-dpk6b.36926 > 20.102.38.122.https: tcp 1083
2025-05-28 10:46:00.072552 enp3s0 In  IP 57.150.27.1.https > linux-amd64-gpu-rtxa6000-latest-2-nemo-6qvzc-runner-dpk6b.46102: tcp 482
2025-05-28 10:46:00.073216 enp3s0 Out IP linux-amd64-gpu-rtxa6000-latest-2-nemo-6qvzc-runner-dpk6b.46102 > 57.150.27.1.https: tcp 0
2025-05-28 10:46:00.084555 enp3s0 Out IP linux-amd64-gpu-rtxa6000-latest-2-nemo-6qvzc-runner-dpk6b.39034 > lb-140-82-112-21-iad.github.com.https: tcp 2848
2025-05-28 10:46:00.084578 enp3s0 Out IP linux-amd64-gpu-rtxa6000-latest-2-nemo-6qvzc-runner-dpk6b.39034 > lb-140-82-112-21-iad.github.com.https: tcp 55
2025-05-28 10:46:00.108367 enp3s0 In  IP 20.102.38.122.https > linux-amd64-gpu-rtxa6000-latest-2-nemo-6qvzc-runner-dpk6b.36926: tcp 0
2025-05-28 10:46:00.108377 enp3s0 In  IP 20.102.38.122.https > linux-amd64-gpu-rtxa6000-latest-2-nemo-6qvzc-runner-dpk6b.36926: tcp 0
2025-05-28 10:46:00.122872 enp3s0 In  IP lb-140-82-112-21-iad.github.com.https > linux-amd64-gpu-rtxa6000-latest-2-nemo-6qvzc-runner-dpk6b.39034: tcp 0
2025-05-28 10:46:00.124163 enp3s0 In  IP 20.102.38.122.https > linux-amd64-gpu-rtxa6000-latest-2-nemo-6qvzc-runner-dpk6b.36926: tcp 2844
2025-05-28 10:46:00.124174 enp3s0 In  IP 20.102.38.122.https > linux-amd64-gpu-rtxa6000-latest-2-nemo-6qvzc-runner-dpk6b.36926: tcp 34
2025-05-28 10:46:00.124251 enp3s0 Out IP linux-amd64-gpu-rtxa6000-latest-2-nemo-6qvzc-runner-dpk6b.36926 > 20.102.38.122.https: tcp 0
2025-05-28 10:46:00.124327 enp3s0 Out IP linux-amd64-gpu-rtxa6000-latest-2-nemo-6qvzc-runner-dpk6b.36926 > 20.102.38.122.https: tcp 0
2025-05-28 10:46:00.158569 enp3s0 In  IP lb-140-82-112-21-iad.github.com.https > linux-amd64-gpu-rtxa6000-latest-2-nemo-6qvzc-runner-dpk6b.39034: tcp 230
2025-05-28 10:46:00.158650 enp3s0 Out IP linux-amd64-gpu-rtxa6000-latest-2-nemo-6qvzc-runner-dpk6b.39034 > lb-140-82-112-21-iad.github.com.https: tcp 0
2025-05-28 10:46:00.163565 enp3s0 Out IP linux-amd64-gpu-rtxa6000-latest-2-nemo-6qvzc-runner-dpk6b.39034 > lb-140-82-112-21-iad.github.com.https: tcp 2848
2025-05-28 10:46:00.201839 enp3s0 In  IP lb-140-82-112-21-iad.github.com.https > linux-amd64-gpu-rtxa6000-latest-2-nemo-6qvzc-runner-dpk6b.39034: tcp 0
2025-05-28 10:46:00.209283 enp3s0 In  IP lb-140-82-112-21-iad.github.com.https > linux-amd64-gpu-rtxa6000-latest-2-nemo-6qvzc-runner-dpk6b.39034: tcp 855
2025-05-28 10:46:00.213003 enp3s0 Out IP linux-amd64-gpu-rtxa6000-latest-2-nemo-6qvzc-runner-dpk6b.46102 > 57.150.27.1.https: tcp 1324
2025-05-28 10:46:00.250838 enp3s0 Out IP linux-amd64-gpu-rtxa6000-latest-2-nemo-6qvzc-runner-dpk6b.39034 > lb-140-82-112-21-iad.github.com.https: tcp 0
2025-05-28 10:46:00.261798 enp3s0 In  IP 57.150.27.1.https > linux-amd64-gpu-rtxa6000-latest-2-nemo-6qvzc-runner-dpk6b.46102: tcp 482
2025-05-28 10:46:00.264203 enp3s0 Out IP linux-amd64-gpu-rtxa6000-latest-2-nemo-6qvzc-runner-dpk6b.39034 > lb-140-82-112-21-iad.github.com.https: tcp 2848
2025-05-28 10:46:00.264223 enp3s0 Out IP linux-amd64-gpu-rtxa6000-latest-2-nemo-6qvzc-runner-dpk6b.39034 > lb-140-82-112-21-iad.github.com.https: tcp 54
2025-05-28 10:46:00.302442 enp3s0 In  IP lb-140-82-112-21-iad.github.com.https > linux-amd64-gpu-rtxa6000-latest-2-nemo-6qvzc-runner-dpk6b.39034: tcp 0
2025-05-28 10:46:00.302782 enp3s0 Out IP linux-amd64-gpu-rtxa6000-latest-2-nemo-6qvzc-runner-dpk6b.46102 > 57.150.27.1.https: tcp 0
2025-05-28 10:46:00.334836 enp3s0 In  IP lb-140-82-112-21-iad.github.com.https > linux-amd64-gpu-rtxa6000-latest-2-nemo-6qvzc-runner-dpk6b.39034: tcp 230
2025-05-28 10:46:00.334917 enp3s0 Out IP linux-amd64-gpu-rtxa6000-latest-2-nemo-6qvzc-runner-dpk6b.39034 > lb-140-82-112-21-iad.github.com.https: tcp 0
2025-05-28 10:46:00.720146 enp3s0 Out IP linux-amd64-gpu-rtxa6000-latest-2-nemo-6qvzc-runner-dpk6b.48620 > ingress-local-ingress-nginx-controller.ingress-nginx.svc.cluster.local.https: tcp 1046
2025-05-28 10:46:00.754984 enp3s0 In  IP ingress-local-ingress-nginx-controller.ingress-nginx.svc.cluster.local.https > linux-amd64-gpu-rtxa6000-latest-2-nemo-6qvzc-runner-dpk6b.48620: tcp 35
2025-05-28 10:46:00.755067 enp3s0 Out IP linux-amd64-gpu-rtxa6000-latest-2-nemo-6qvzc-runner-dpk6b.48620 > ingress-local-ingress-nginx-controller.ingress-nginx.svc.cluster.local.https: tcp 2285
2025-05-28 10:46:00.789861 enp3s0 In  IP ingress-local-ingress-nginx-controller.ingress-nginx.svc.cluster.local.https > linux-amd64-gpu-rtxa6000-latest-2-nemo-6qvzc-runner-dpk6b.48620: tcp 129
2025-05-28 10:46:00.789871 enp3s0 In  IP ingress-local-ingress-nginx-controller.ingress-nginx.svc.cluster.local.https > linux-amd64-gpu-rtxa6000-latest-2-nemo-6qvzc-runner-dpk6b.48620: tcp 43
2025-05-28 10:46:00.790250 enp3s0 Out IP linux-amd64-gpu-rtxa6000-latest-2-nemo-6qvzc-runner-dpk6b.48620 > ingress-local-ingress-nginx-controller.ingress-nginx.svc.cluster.local.https: tcp 0
2025-05-28 10:46:01.934805 enp3s0 Out IP linux-amd64-gpu-rtxa6000-latest-2-nemo-6qvzc-runner-dpk6b.37062 > 52.224.205.173.https: tcp 0
2025-05-28 10:46:02.511023 vethb391c0f Out IP6 linux-amd64-gpu-rtxa6000-latest-2-nemo-6qvzc-runner-dpk6b > ip6-allrouters: ICMP6, router solicitation, length 16
2025-05-28 10:46:03.110413 lo    In  IP localhost.54878 > localhost.9400: tcp 0
2025-05-28 10:46:03.110452 lo    In  IP localhost.9400 > localhost.54878: tcp 0
2025-05-28 10:46:03.110477 lo    In  IP localhost.54878 > localhost.9400: tcp 0
2025-05-28 10:46:03.111571 docker0 Out ARP, Request who-has 172.17.0.2 tell lo0-gw1.dce-ca.nvidia.com, length 28
2025-05-28 10:46:03.111602 vethb391c0f Out ARP, Request who-has 172.17.0.2 tell lo0-gw1.dce-ca.nvidia.com, length 28
2025-05-28 10:46:03.111801 vethb391c0f P   ARP, Reply 172.17.0.2 is-at 1e:d7:cf:c5:11:01 (oui Unknown), length 28
2025-05-28 10:46:03.111801 docker0 In  ARP, Reply 172.17.0.2 is-at 1e:d7:cf:c5:11:01 (oui Unknown), length 28
2025-05-28 10:46:03.111826 docker0 Out IP lo0-gw1.dce-ca.nvidia.com.52610 > 172.17.0.2.9400: tcp 0
2025-05-28 10:46:03.111842 vethb391c0f Out IP lo0-gw1.dce-ca.nvidia.com.52610 > 172.17.0.2.9400: tcp 0
2025-05-28 10:46:03.111952 vethb391c0f P   IP 172.17.0.2.9400 > lo0-gw1.dce-ca.nvidia.com.52610: tcp 0
2025-05-28 10:46:03.111952 docker0 In  IP 172.17.0.2.9400 > lo0-gw1.dce-ca.nvidia.com.52610: tcp 0
2025-05-28 10:46:03.112027 docker0 Out IP lo0-gw1.dce-ca.nvidia.com.52610 > 172.17.0.2.9400: tcp 0
2025-05-28 10:46:03.112040 vethb391c0f Out IP lo0-gw1.dce-ca.nvidia.com.52610 > 172.17.0.2.9400: tcp 0
2025-05-28 10:46:03.112290 lo    In  IP localhost.54878 > localhost.9400: tcp 186
2025-05-28 10:46:03.112309 lo    In  IP localhost.9400 > localhost.54878: tcp 0
2025-05-28 10:46:03.112904 docker0 Out IP lo0-gw1.dce-ca.nvidia.com.52610 > 172.17.0.2.9400: tcp 186
2025-05-28 10:46:03.112915 vethb391c0f Out IP lo0-gw1.dce-ca.nvidia.com.52610 > 172.17.0.2.9400: tcp 186
2025-05-28 10:46:03.112942 vethb391c0f P   IP 172.17.0.2.9400 > lo0-gw1.dce-ca.nvidia.com.52610: tcp 0
2025-05-28 10:46:03.112942 docker0 In  IP 172.17.0.2.9400 > lo0-gw1.dce-ca.nvidia.com.52610: tcp 0
2025-05-28 10:46:03.119240 vethb391c0f P   IP 172.17.0.2.9400 > lo0-gw1.dce-ca.nvidia.com.52610: tcp 4096
2025-05-28 10:46:03.119240 docker0 In  IP 172.17.0.2.9400 > lo0-gw1.dce-ca.nvidia.com.52610: tcp 4096
2025-05-28 10:46:03.119289 docker0 Out IP lo0-gw1.dce-ca.nvidia.com.52610 > 172.17.0.2.9400: tcp 0
2025-05-28 10:46:03.119295 vethb391c0f Out IP lo0-gw1.dce-ca.nvidia.com.52610 > 172.17.0.2.9400: tcp 0
2025-05-28 10:46:03.119327 vethb391c0f P   IP 172.17.0.2.9400 > lo0-gw1.dce-ca.nvidia.com.52610: tcp 7140
2025-05-28 10:46:03.119327 docker0 In  IP 172.17.0.2.9400 > lo0-gw1.dce-ca.nvidia.com.52610: tcp 7140
2025-05-28 10:46:03.119343 docker0 Out IP lo0-gw1.dce-ca.nvidia.com.52610 > 172.17.0.2.9400: tcp 0
2025-05-28 10:46:03.119347 vethb391c0f Out IP lo0-gw1.dce-ca.nvidia.com.52610 > 172.17.0.2.9400: tcp 0
2025-05-28 10:46:03.119361 vethb391c0f P   IP 172.17.0.2.9400 > lo0-gw1.dce-ca.nvidia.com.52610: tcp 4711
2025-05-28 10:46:03.119361 docker0 In  IP 172.17.0.2.9400 > lo0-gw1.dce-ca.nvidia.com.52610: tcp 4711
2025-05-28 10:46:03.119374 docker0 Out IP lo0-gw1.dce-ca.nvidia.com.52610 > 172.17.0.2.9400: tcp 0
2025-05-28 10:46:03.119378 vethb391c0f Out IP lo0-gw1.dce-ca.nvidia.com.52610 > 172.17.0.2.9400: tcp 0
2025-05-28 10:46:03.119400 lo    In  IP localhost.9400 > localhost.54878: tcp 11236
2025-05-28 10:46:03.119408 vethb391c0f P   IP 172.17.0.2.9400 > lo0-gw1.dce-ca.nvidia.com.52610: tcp 7
2025-05-28 10:46:03.119408 docker0 In  IP 172.17.0.2.9400 > lo0-gw1.dce-ca.nvidia.com.52610: tcp 7
2025-05-28 10:46:03.119416 docker0 Out IP lo0-gw1.dce-ca.nvidia.com.52610 > 172.17.0.2.9400: tcp 0
2025-05-28 10:46:03.119420 vethb391c0f Out IP lo0-gw1.dce-ca.nvidia.com.52610 > 172.17.0.2.9400: tcp 0
2025-05-28 10:46:03.119434 lo    In  IP localhost.54878 > localhost.9400: tcp 0
2025-05-28 10:46:03.119473 lo    In  IP localhost.9400 > localhost.54878: tcp 4718
2025-05-28 10:46:03.119493 lo    In  IP localhost.54878 > localhost.9400: tcp 0
2025-05-28 10:46:03.916085 enp3s0 Out IP linux-amd64-gpu-rtxa6000-latest-2-nemo-6qvzc-runner-dpk6b.39028 > lb-140-82-112-21-iad.github.com.https: tcp 291
2025-05-28 10:46:03.923383 lo    In  IP localhost.48794 > localhost.domain: UDP, length 126
2025-05-28 10:46:03.923419 lo    In  IP localhost.48794 > localhost.domain: UDP, length 126
2025-05-28 10:46:03.924101 enp3s0 Out IP linux-amd64-gpu-rtxa6000-latest-2-nemo-6qvzc-runner-dpk6b.46963 > kube-dns.kube-system.svc.cluster.local.domain: UDP, length 126
2025-05-28 10:46:03.924437 enp3s0 Out IP linux-amd64-gpu-rtxa6000-latest-2-nemo-6qvzc-runner-dpk6b.41035 > kube-dns.kube-system.svc.cluster.local.domain: UDP, length 126
2025-05-28 10:46:03.941096 lo    In  IP localhost.53689 > localhost.domain: UDP, length 35
2025-05-28 10:46:03.941152 lo    In  IP localhost.53689 > localhost.domain: UDP, length 35
2025-05-28 10:46:03.941254 enp3s0 Out IP linux-amd64-gpu-rtxa6000-latest-2-nemo-6qvzc-runner-dpk6b.54282 > kube-dns.kube-system.svc.cluster.local.domain: UDP, length 35
2025-05-28 10:46:03.941315 enp3s0 Out IP linux-amd64-gpu-rtxa6000-latest-2-nemo-6qvzc-runner-dpk6b.56312 > kube-dns.kube-system.svc.cluster.local.domain: UDP, length 35
2025-05-28 10:46:03.954469 enp3s0 In  IP lb-140-82-112-21-iad.github.com.https > linux-amd64-gpu-rtxa6000-latest-2-nemo-6qvzc-runner-dpk6b.39028: tcp 0
2025-05-28 10:46:03.965802 enp3s0 In  IP kube-dns.kube-system.svc.cluster.local.domain > linux-amd64-gpu-rtxa6000-latest-2-nemo-6qvzc-runner-dpk6b.41035: UDP, length 219
2025-05-28 10:46:03.966174 enp3s0 Out IP linux-amd64-gpu-rtxa6000-latest-2-nemo-6qvzc-runner-dpk6b.41035 > kube-dns.kube-system.svc.cluster.local.domain: UDP, length 115
2025-05-28 10:46:03.978223 enp3s0 In  IP kube-dns.kube-system.svc.cluster.local.domain > linux-amd64-gpu-rtxa6000-latest-2-nemo-6qvzc-runner-dpk6b.46963: UDP, length 219
2025-05-28 10:46:03.978892 enp3s0 Out IP linux-amd64-gpu-rtxa6000-latest-2-nemo-6qvzc-runner-dpk6b.46963 > kube-dns.kube-system.svc.cluster.local.domain: UDP, length 115
2025-05-28 10:46:03.995281 enp3s0 In  IP kube-dns.kube-system.svc.cluster.local.domain > linux-amd64-gpu-rtxa6000-latest-2-nemo-6qvzc-runner-dpk6b.56312: UDP, length 111
2025-05-28 10:46:03.995292 enp3s0 In  IP kube-dns.kube-system.svc.cluster.local.domain > linux-amd64-gpu-rtxa6000-latest-2-nemo-6qvzc-runner-dpk6b.54282: UDP, length 57
2025-05-28 10:46:03.995968 lo    In  IP localhost.domain > localhost.53689: UDP, length 105
2025-05-28 10:46:03.996234 lo    In  IP localhost.domain > localhost.53689: UDP, length 51
2025-05-28 10:46:03.997148 enp3s0 Out IP linux-amd64-gpu-rtxa6000-latest-2-nemo-6qvzc-runner-dpk6b.59248 > a23-223-25-254.deploy.static.akamaitechnologies.com.https: tcp 0
2025-05-28 10:46:04.007598 enp3s0 In  IP kube-dns.kube-system.svc.cluster.local.domain > linux-amd64-gpu-rtxa6000-latest-2-nemo-6qvzc-runner-dpk6b.41035: UDP, length 208
2025-05-28 10:46:04.008066 lo    In  IP localhost.domain > localhost.48794: UDP, length 180
2025-05-28 10:46:04.033100 enp3s0 In  IP kube-dns.kube-system.svc.cluster.local.domain > linux-amd64-gpu-rtxa6000-latest-2-nemo-6qvzc-runner-dpk6b.46963: UDP, length 208
2025-05-28 10:46:04.033484 lo    In  IP localhost.domain > localhost.48794: UDP, length 180
2025-05-28 10:46:04.033990 lo    In  IP localhost.56171 > localhost.domain: UDP, length 104
2025-05-28 10:46:04.034063 lo    In  IP localhost.56171 > localhost.domain: UDP, length 104
2025-05-28 10:46:04.034409 enp3s0 Out IP linux-amd64-gpu-rtxa6000-latest-2-nemo-6qvzc-runner-dpk6b.53364 > kube-dns.kube-system.svc.cluster.local.domain: UDP, length 104
2025-05-28 10:46:04.034768 enp3s0 Out IP linux-amd64-gpu-rtxa6000-latest-2-nemo-6qvzc-runner-dpk6b.52695 > kube-dns.kube-system.svc.cluster.local.domain: UDP, length 104
2025-05-28 10:46:04.076343 enp3s0 In  IP kube-dns.kube-system.svc.cluster.local.domain > linux-amd64-gpu-rtxa6000-latest-2-nemo-6qvzc-runner-dpk6b.52695: UDP, length 197
2025-05-28 10:46:04.076529 enp3s0 Out IP linux-amd64-gpu-rtxa6000-latest-2-nemo-6qvzc-runner-dpk6b.52695 > kube-dns.kube-system.svc.cluster.local.domain: UDP, length 93
2025-05-28 10:46:04.088660 enp3s0 In  IP kube-dns.kube-system.svc.cluster.local.domain > linux-amd64-gpu-rtxa6000-latest-2-nemo-6qvzc-runner-dpk6b.53364: UDP, length 197
2025-05-28 10:46:04.088844 enp3s0 Out IP linux-amd64-gpu-rtxa6000-latest-2-nemo-6qvzc-runner-dpk6b.53364 > kube-dns.kube-system.svc.cluster.local.domain: UDP, length 93
2025-05-28 10:46:04.107100 enp3s0 Out IP linux-amd64-gpu-rtxa6000-latest-2-nemo-6qvzc-runner-dpk6b.48620 > ingress-local-ingress-nginx-controller.ingress-nginx.svc.cluster.local.https: tcp 1046
2025-05-28 10:46:04.107199 enp3s0 Out IP linux-amd64-gpu-rtxa6000-latest-2-nemo-6qvzc-runner-dpk6b.48620 > ingress-local-ingress-nginx-controller.ingress-nginx.svc.cluster.local.https: tcp 8928
2025-05-28 10:46:04.107282 enp3s0 Out IP linux-amd64-gpu-rtxa6000-latest-2-nemo-6qvzc-runner-dpk6b.48620 > ingress-local-ingress-nginx-controller.ingress-nginx.svc.cluster.local.https: tcp 17856
2025-05-28 10:46:04.107360 enp3s0 Out IP linux-amd64-gpu-rtxa6000-latest-2-nemo-6qvzc-runner-dpk6b.48620 > ingress-local-ingress-nginx-controller.ingress-nginx.svc.cluster.local.https: tcp 17856
2025-05-28 10:46:04.107426 enp3s0 Out IP linux-amd64-gpu-rtxa6000-latest-2-nemo-6qvzc-runner-dpk6b.48620 > ingress-local-ingress-nginx-controller.ingress-nginx.svc.cluster.local.https: tcp 17856
2025-05-28 10:46:04.118191 enp3s0 In  IP kube-dns.kube-system.svc.cluster.local.domain > linux-amd64-gpu-rtxa6000-latest-2-nemo-6qvzc-runner-dpk6b.52695: UDP, length 186
2025-05-28 10:46:04.118420 lo    In  IP localhost.domain > localhost.56171: UDP, length 158
2025-05-28 10:46:04.141109 enp3s0 Out IP linux-amd64-gpu-rtxa6000-latest-2-nemo-6qvzc-runner-dpk6b.36926 > 20.102.38.122.https: tcp 2856
2025-05-28 10:46:04.141129 enp3s0 Out IP linux-amd64-gpu-rtxa6000-latest-2-nemo-6qvzc-runner-dpk6b.36926 > 20.102.38.122.https: tcp 1269
2025-05-28 10:46:04.141565 enp3s0 Out IP linux-amd64-gpu-rtxa6000-latest-2-nemo-6qvzc-runner-dpk6b.36926 > 20.102.38.122.https: tcp 166
2025-05-28 10:46:04.142032 enp3s0 In  IP ingress-local-ingress-nginx-controller.ingress-nginx.svc.cluster.local.https > linux-amd64-gpu-rtxa6000-latest-2-nemo-6qvzc-runner-dpk6b.48620: tcp 35
2025-05-28 10:46:04.142145 enp3s0 Out IP linux-amd64-gpu-rtxa6000-latest-2-nemo-6qvzc-runner-dpk6b.48620 > ingress-local-ingress-nginx-controller.ingress-nginx.svc.cluster.local.https: tcp 2147
2025-05-28 10:46:04.142294 enp3s0 In  IP ingress-local-ingress-nginx-controller.ingress-nginx.svc.cluster.local.https > linux-amd64-gpu-rtxa6000-latest-2-nemo-6qvzc-runner-dpk6b.48620: tcp 35
2025-05-28 10:46:04.142548 enp3s0 In  IP kube-dns.kube-system.svc.cluster.local.domain > linux-amd64-gpu-rtxa6000-latest-2-nemo-6qvzc-runner-dpk6b.53364: UDP, length 186
2025-05-28 10:46:04.142793 lo    In  IP localhost.domain > localhost.56171: UDP, length 158
2025-05-28 10:46:04.143040 enp3s0 Out IP linux-amd64-gpu-rtxa6000-latest-2-nemo-6qvzc-runner-dpk6b.48620 > ingress-local-ingress-nginx-controller.ingress-nginx.svc.cluster.local.https: tcp 8928
2025-05-28 10:46:04.143128 enp3s0 Out IP linux-amd64-gpu-rtxa6000-latest-2-nemo-6qvzc-runner-dpk6b.48620 > ingress-local-ingress-nginx-controller.ingress-nginx.svc.cluster.local.https: tcp 8928
2025-05-28 10:46:04.143221 lo    In  IP localhost.41623 > localhost.domain: UDP, length 100
2025-05-28 10:46:04.143291 lo    In  IP localhost.41623 > localhost.domain: UDP, length 100
2025-05-28 10:46:04.143415 enp3s0 Out IP linux-amd64-gpu-rtxa6000-latest-2-nemo-6qvzc-runner-dpk6b.57859 > kube-dns.kube-system.svc.cluster.local.domain: UDP, length 100
2025-05-28 10:46:04.143490 enp3s0 Out IP linux-amd64-gpu-rtxa6000-latest-2-nemo-6qvzc-runner-dpk6b.60843 > kube-dns.kube-system.svc.cluster.local.domain: UDP, length 100
2025-05-28 10:46:04.145646 enp3s0 In  IP a23-223-25-254.deploy.static.akamaitechnologies.com.https > linux-amd64-gpu-rtxa6000-latest-2-nemo-6qvzc-runner-dpk6b.59248: tcp 0
2025-05-28 10:46:04.145766 enp3s0 Out IP linux-amd64-gpu-rtxa6000-latest-2-nemo-6qvzc-runner-dpk6b.59248 > a23-223-25-254.deploy.static.akamaitechnologies.com.https: tcp 0
2025-05-28 10:46:04.168560 enp3s0 Out IP linux-amd64-gpu-rtxa6000-latest-2-nemo-6qvzc-runner-dpk6b.39028 > lb-140-82-112-21-iad.github.com.https: tcp 227
2025-05-28 10:46:04.176663 enp3s0 In  IP ingress-local-ingress-nginx-controller.ingress-nginx.svc.cluster.local.https > linux-amd64-gpu-rtxa6000-latest-2-nemo-6qvzc-runner-dpk6b.48620: tcp 35
2025-05-28 10:46:04.176758 enp3s0 Out IP linux-amd64-gpu-rtxa6000-latest-2-nemo-6qvzc-runner-dpk6b.48620 > ingress-local-ingress-nginx-controller.ingress-nginx.svc.cluster.local.https: tcp 4059
2025-05-28 10:46:04.177713 enp3s0 In  IP ingress-local-ingress-nginx-controller.ingress-nginx.svc.cluster.local.https > linux-amd64-gpu-rtxa6000-latest-2-nemo-6qvzc-runner-dpk6b.48620: tcp 0
2025-05-28 10:46:04.177724 enp3s0 In  IP ingress-local-ingress-nginx-controller.ingress-nginx.svc.cluster.local.https > linux-amd64-gpu-rtxa6000-latest-2-nemo-6qvzc-runner-dpk6b.48620: tcp 35
2025-05-28 10:46:04.181197 enp3s0 In  IP 20.102.38.122.https > linux-amd64-gpu-rtxa6000-latest-2-nemo-6qvzc-runner-dpk6b.36926: tcp 0
2025-05-28 10:46:04.181207 enp3s0 In  IP 20.102.38.122.https > linux-amd64-gpu-rtxa6000-latest-2-nemo-6qvzc-runner-dpk6b.36926: tcp 0
2025-05-28 10:46:04.195450 enp3s0 Out IP linux-amd64-gpu-rtxa6000-latest-2-nemo-6qvzc-runner-dpk6b.59248 > a23-223-25-254.deploy.static.akamaitechnologies.com.https: tcp 517
2025-05-28 10:46:04.197520 enp3s0 In  IP kube-dns.kube-system.svc.cluster.local.domain > linux-amd64-gpu-rtxa6000-latest-2-nemo-6qvzc-runner-dpk6b.60843: UDP, length 193
2025-05-28 10:46:04.197523 enp3s0 In  IP kube-dns.kube-system.svc.cluster.local.domain > linux-amd64-gpu-rtxa6000-latest-2-nemo-6qvzc-runner-dpk6b.57859: UDP, length 193
2025-05-28 10:46:04.197986 enp3s0 Out IP linux-amd64-gpu-rtxa6000-latest-2-nemo-6qvzc-runner-dpk6b.60843 > kube-dns.kube-system.svc.cluster.local.domain: UDP, length 89
2025-05-28 10:46:04.198168 enp3s0 Out IP linux-amd64-gpu-rtxa6000-latest-2-nemo-6qvzc-runner-dpk6b.57859 > kube-dns.kube-system.svc.cluster.local.domain: UDP, length 89
2025-05-28 10:46:04.199854 enp3s0 In  IP 20.102.38.122.https > linux-amd64-gpu-rtxa6000-latest-2-nemo-6qvzc-runner-dpk6b.36926: tcp 2385
2025-05-28 10:46:04.199857 enp3s0 In  IP 20.102.38.122.https > linux-amd64-gpu-rtxa6000-latest-2-nemo-6qvzc-runner-dpk6b.36926: tcp 34
2025-05-28 10:46:04.199898 enp3s0 Out IP linux-amd64-gpu-rtxa6000-latest-2-nemo-6qvzc-runner-dpk6b.36926 > 20.102.38.122.https: tcp 0
2025-05-28 10:46:04.199941 enp3s0 Out IP linux-amd64-gpu-rtxa6000-latest-2-nemo-6qvzc-runner-dpk6b.36926 > 20.102.38.122.https: tcp 0
2025-05-28 10:46:04.203909 enp3s0 Out IP linux-amd64-gpu-rtxa6000-latest-2-nemo-6qvzc-runner-dpk6b.39034 > lb-140-82-112-21-iad.github.com.https: tcp 2848
2025-05-28 10:46:04.203930 enp3s0 Out IP linux-amd64-gpu-rtxa6000-latest-2-nemo-6qvzc-runner-dpk6b.39034 > lb-140-82-112-21-iad.github.com.https: tcp 362
2025-05-28 10:46:04.206961 enp3s0 In  IP lb-140-82-112-21-iad.github.com.https > linux-amd64-gpu-rtxa6000-latest-2-nemo-6qvzc-runner-dpk6b.39028: tcp 0
2025-05-28 10:46:04.214151 enp3s0 In  IP ingress-local-ingress-nginx-controller.ingress-nginx.svc.cluster.local.https > linux-amd64-gpu-rtxa6000-latest-2-nemo-6qvzc-runner-dpk6b.48620: tcp 129
2025-05-28 10:46:04.214160 enp3s0 In  IP ingress-local-ingress-nginx-controller.ingress-nginx.svc.cluster.local.https > linux-amd64-gpu-rtxa6000-latest-2-nemo-6qvzc-runner-dpk6b.48620: tcp 43
2025-05-28 10:46:04.214203 enp3s0 Out IP linux-amd64-gpu-rtxa6000-latest-2-nemo-6qvzc-runner-dpk6b.48620 > ingress-local-ingress-nginx-controller.ingress-nginx.svc.cluster.local.https: tcp 0
2025-05-28 10:46:04.242447 enp3s0 In  IP lb-140-82-112-21-iad.github.com.https > linux-amd64-gpu-rtxa6000-latest-2-nemo-6qvzc-runner-dpk6b.39034: tcp 0
2025-05-28 10:46:04.252439 enp3s0 In  IP kube-dns.kube-system.svc.cluster.local.domain > linux-amd64-gpu-rtxa6000-latest-2-nemo-6qvzc-runner-dpk6b.60843: UDP, length 182
2025-05-28 10:46:04.252450 enp3s0 In  IP kube-dns.kube-system.svc.cluster.local.domain > linux-amd64-gpu-rtxa6000-latest-2-nemo-6qvzc-runner-dpk6b.57859: UDP, length 182
2025-05-28 10:46:04.252461 enp3s0 In  IP lb-140-82-112-21-iad.github.com.https > linux-amd64-gpu-rtxa6000-latest-2-nemo-6qvzc-runner-dpk6b.39034: tcp 230
2025-05-28 10:46:04.252596 enp3s0 Out IP linux-amd64-gpu-rtxa6000-latest-2-nemo-6qvzc-runner-dpk6b.39034 > lb-140-82-112-21-iad.github.com.https: tcp 0
2025-05-28 10:46:04.253226 lo    In  IP localhost.domain > localhost.41623: UDP, length 154
2025-05-28 10:46:04.253534 lo    In  IP localhost.domain > localhost.41623: UDP, length 154
2025-05-28 10:46:04.253835 lo    In  IP localhost.49505 > localhost.domain: UDP, length 101
2025-05-28 10:46:04.253908 lo    In  IP localhost.49505 > localhost.domain: UDP, length 101
2025-05-28 10:46:04.254291 enp3s0 Out IP linux-amd64-gpu-rtxa6000-latest-2-nemo-6qvzc-runner-dpk6b.46625 > kube-dns.kube-system.svc.cluster.local.domain: UDP, length 101
2025-05-28 10:46:04.254571 enp3s0 Out IP linux-amd64-gpu-rtxa6000-latest-2-nemo-6qvzc-runner-dpk6b.48282 > kube-dns.kube-system.svc.cluster.local.domain: UDP, length 101
2025-05-28 10:46:04.254856 enp3s0 Out IP linux-amd64-gpu-rtxa6000-latest-2-nemo-6qvzc-runner-dpk6b.48620 > ingress-local-ingress-nginx-controller.ingress-nginx.svc.cluster.local.https: tcp 0
2025-05-28 10:46:04.311102 enp3s0 In  IP kube-dns.kube-system.svc.cluster.local.domain > linux-amd64-gpu-rtxa6000-latest-2-nemo-6qvzc-runner-dpk6b.46625: UDP, length 210
2025-05-28 10:46:04.311696 enp3s0 Out IP linux-amd64-gpu-rtxa6000-latest-2-nemo-6qvzc-runner-dpk6b.46625 > kube-dns.kube-system.svc.cluster.local.domain: UDP, length 90
2025-05-28 10:46:04.332802 enp3s0 In  IP kube-dns.kube-system.svc.cluster.local.domain > linux-amd64-gpu-rtxa6000-latest-2-nemo-6qvzc-runner-dpk6b.48282: UDP, length 210
2025-05-28 10:46:04.333270 enp3s0 Out IP linux-amd64-gpu-rtxa6000-latest-2-nemo-6qvzc-runner-dpk6b.48282 > kube-dns.kube-system.svc.cluster.local.domain: UDP, length 90
2025-05-28 10:46:04.344550 enp3s0 In  IP a23-223-25-254.deploy.static.akamaitechnologies.com.https > linux-amd64-gpu-rtxa6000-latest-2-nemo-6qvzc-runner-dpk6b.59248: tcp 0
2025-05-28 10:46:04.346179 enp3s0 Out IP linux-amd64-gpu-rtxa6000-latest-2-nemo-6qvzc-runner-dpk6b.39034 > lb-140-82-112-21-iad.github.com.https: tcp 2848
2025-05-28 10:46:04.347765 enp3s0 In  IP a23-223-25-254.deploy.static.akamaitechnologies.com.https > linux-amd64-gpu-rtxa6000-latest-2-nemo-6qvzc-runner-dpk6b.59248: tcp 1448
2025-05-28 10:46:04.347798 enp3s0 Out IP linux-amd64-gpu-rtxa6000-latest-2-nemo-6qvzc-runner-dpk6b.59248 > a23-223-25-254.deploy.static.akamaitechnologies.com.https: tcp 0
2025-05-28 10:46:04.347883 enp3s0 In  IP a23-223-25-254.deploy.static.akamaitechnologies.com.https > linux-amd64-gpu-rtxa6000-latest-2-nemo-6qvzc-runner-dpk6b.59248: tcp 1448
2025-05-28 10:46:04.347902 enp3s0 Out IP linux-amd64-gpu-rtxa6000-latest-2-nemo-6qvzc-runner-dpk6b.59248 > a23-223-25-254.deploy.static.akamaitechnologies.com.https: tcp 0
2025-05-28 10:46:04.348011 enp3s0 In  IP a23-223-25-254.deploy.static.akamaitechnologies.com.https > linux-amd64-gpu-rtxa6000-latest-2-nemo-6qvzc-runner-dpk6b.59248: tcp 1200
2025-05-28 10:46:04.348027 enp3s0 Out IP linux-amd64-gpu-rtxa6000-latest-2-nemo-6qvzc-runner-dpk6b.59248 > a23-223-25-254.deploy.static.akamaitechnologies.com.https: tcp 0
2025-05-28 10:46:04.348215 enp3s0 In  IP a23-223-25-254.deploy.static.akamaitechnologies.com.https > linux-amd64-gpu-rtxa6000-latest-2-nemo-6qvzc-runner-dpk6b.59248: tcp 162
2025-05-28 10:46:04.348229 enp3s0 Out IP linux-amd64-gpu-rtxa6000-latest-2-nemo-6qvzc-runner-dpk6b.59248 > a23-223-25-254.deploy.static.akamaitechnologies.com.https: tcp 0
2025-05-28 10:46:04.351171 enp3s0 Out IP linux-amd64-gpu-rtxa6000-latest-2-nemo-6qvzc-runner-dpk6b.59248 > a23-223-25-254.deploy.static.akamaitechnologies.com.https: tcp 80
2025-05-28 10:46:04.351392 enp3s0 Out IP linux-amd64-gpu-rtxa6000-latest-2-nemo-6qvzc-runner-dpk6b.59248 > a23-223-25-254.deploy.static.akamaitechnologies.com.https: tcp 110
2025-05-28 10:46:04.352757 enp3s0 In  IP kube-dns.kube-system.svc.cluster.local.domain > linux-amd64-gpu-rtxa6000-latest-2-nemo-6qvzc-runner-dpk6b.46625: UDP, length 199
2025-05-28 10:46:04.352967 lo    In  IP localhost.domain > localhost.49505: UDP, length 186
2025-05-28 10:46:04.374379 enp3s0 In  IP kube-dns.kube-system.svc.cluster.local.domain > linux-amd64-gpu-rtxa6000-latest-2-nemo-6qvzc-runner-dpk6b.48282: UDP, length 199
2025-05-28 10:46:04.374533 lo    In  IP localhost.domain > localhost.49505: UDP, length 186
2025-05-28 10:46:04.374957 lo    In  IP localhost.52615 > localhost.domain: UDP, length 97
2025-05-28 10:46:04.375023 lo    In  IP localhost.52615 > localhost.domain: UDP, length 97
2025-05-28 10:46:04.375144 enp3s0 Out IP linux-amd64-gpu-rtxa6000-latest-2-nemo-6qvzc-runner-dpk6b.44388 > kube-dns.kube-system.svc.cluster.local.domain: UDP, length 97
2025-05-28 10:46:04.375219 enp3s0 Out IP linux-amd64-gpu-rtxa6000-latest-2-nemo-6qvzc-runner-dpk6b.52771 > kube-dns.kube-system.svc.cluster.local.domain: UDP, length 97
2025-05-28 10:46:04.384326 enp3s0 In  IP lb-140-82-112-21-iad.github.com.https > linux-amd64-gpu-rtxa6000-latest-2-nemo-6qvzc-runner-dpk6b.39034: tcp 0
2025-05-28 10:46:04.393149 enp3s0 In  IP lb-140-82-112-21-iad.github.com.https > linux-amd64-gpu-rtxa6000-latest-2-nemo-6qvzc-runner-dpk6b.39034: tcp 853
2025-05-28 10:46:04.393190 enp3s0 Out IP linux-amd64-gpu-rtxa6000-latest-2-nemo-6qvzc-runner-dpk6b.39034 > lb-140-82-112-21-iad.github.com.https: tcp 0
2025-05-28 10:46:04.396172 enp3s0 Out IP linux-amd64-gpu-rtxa6000-latest-2-nemo-6qvzc-runner-dpk6b.46102 > 57.150.27.1.https: tcp 1545
2025-05-28 10:46:04.429375 enp3s0 In  IP kube-dns.kube-system.svc.cluster.local.domain > linux-amd64-gpu-rtxa6000-latest-2-nemo-6qvzc-runner-dpk6b.52771: UDP, length 197
2025-05-28 10:46:04.429901 enp3s0 Out IP linux-amd64-gpu-rtxa6000-latest-2-nemo-6qvzc-runner-dpk6b.52771 > kube-dns.kube-system.svc.cluster.local.domain: UDP, length 86
2025-05-28 10:46:04.435477 enp3s0 In  IP 57.150.27.1.https > linux-amd64-gpu-rtxa6000-latest-2-nemo-6qvzc-runner-dpk6b.46102: tcp 0
2025-05-28 10:46:04.445928 enp3s0 In  IP 57.150.27.1.https > linux-amd64-gpu-rtxa6000-latest-2-nemo-6qvzc-runner-dpk6b.46102: tcp 482
2025-05-28 10:46:04.446048 enp3s0 Out IP linux-amd64-gpu-rtxa6000-latest-2-nemo-6qvzc-runner-dpk6b.46102 > 57.150.27.1.https: tcp 0
2025-05-28 10:46:04.449559 enp3s0 Out IP linux-amd64-gpu-rtxa6000-latest-2-nemo-6qvzc-runner-dpk6b.39034 > lb-140-82-112-21-iad.github.com.https: tcp 2848
2025-05-28 10:46:04.449577 enp3s0 Out IP linux-amd64-gpu-rtxa6000-latest-2-nemo-6qvzc-runner-dpk6b.39034 > lb-140-82-112-21-iad.github.com.https: tcp 54
2025-05-28 10:46:04.458938 enp3s0 In  IP kube-dns.kube-system.svc.cluster.local.domain > linux-amd64-gpu-rtxa6000-latest-2-nemo-6qvzc-runner-dpk6b.44388: UDP, length 197
2025-05-28 10:46:04.459287 enp3s0 Out IP linux-amd64-gpu-rtxa6000-latest-2-nemo-6qvzc-runner-dpk6b.44388 > kube-dns.kube-system.svc.cluster.local.domain: UDP, length 86
2025-05-28 10:46:04.483977 enp3s0 In  IP kube-dns.kube-system.svc.cluster.local.domain > linux-amd64-gpu-rtxa6000-latest-2-nemo-6qvzc-runner-dpk6b.52771: UDP, length 186
2025-05-28 10:46:04.484608 lo    In  IP localhost.domain > localhost.52615: UDP, length 167
2025-05-28 10:46:04.488041 enp3s0 In  IP lb-140-82-112-21-iad.github.com.https > linux-amd64-gpu-rtxa6000-latest-2-nemo-6qvzc-runner-dpk6b.39034: tcp 0
2025-05-28 10:46:04.513209 enp3s0 In  IP kube-dns.kube-system.svc.cluster.local.domain > linux-amd64-gpu-rtxa6000-latest-2-nemo-6qvzc-runner-dpk6b.44388: UDP, length 186
2025-05-28 10:46:04.513668 lo    In  IP localhost.domain > localhost.52615: UDP, length 167
2025-05-28 10:46:04.514002 lo    In  IP localhost.34386 > localhost.domain: UDP, length 86
2025-05-28 10:46:04.514069 lo    In  IP localhost.34386 > localhost.domain: UDP, length 86
2025-05-28 10:46:04.514500 lo    In  IP localhost.domain > localhost.34386: UDP, length 118
2025-05-28 10:46:04.514995 lo    In  IP localhost.domain > localhost.34386: UDP, length 170
2025-05-28 10:46:04.520687 enp3s0 In  IP a23-223-25-254.deploy.static.akamaitechnologies.com.https > linux-amd64-gpu-rtxa6000-latest-2-nemo-6qvzc-runner-dpk6b.59248: tcp 287
2025-05-28 10:46:04.520699 enp3s0 In  IP a23-223-25-254.deploy.static.akamaitechnologies.com.https > linux-amd64-gpu-rtxa6000-latest-2-nemo-6qvzc-runner-dpk6b.59248: tcp 287
2025-05-28 10:46:04.521384 enp3s0 Out IP linux-amd64-gpu-rtxa6000-latest-2-nemo-6qvzc-runner-dpk6b.59248 > a23-223-25-254.deploy.static.akamaitechnologies.com.https: tcp 0
2025-05-28 10:46:04.522018 enp3s0 In  IP a23-223-25-254.deploy.static.akamaitechnologies.com.https > linux-amd64-gpu-rtxa6000-latest-2-nemo-6qvzc-runner-dpk6b.59248: tcp 496
